ArticleID,ArticleTitle,Rec1,Rec2,Rec3,Rec4,Rec5
-4524355549457527387,While doves were crying: this week on Google Cloud Platform,Google Cloud Platform: The smart person's guide - TechRepublic,Google connects BigQuery to Google Drive and Sheets,8 must-see sessions for application developers at Google Cloud Next '17,BigQuery goes wide: this week on Google Cloud Platform,"Inside Capacitor, BigQuery's next-generation columnar storage format | Google Cloud Big Data Blog"
-4754223659064624252,Effective learning through code workshops | Box Blog,The Importance of Code Reviews,Creating Your Code Review Checklist - DaedTech,Don't document your code. Code your documentation.,What to look for in a code review ,Leveling Up Your JavaScript -
-1654063646246197191,Big IT Rising,Embracing Agile,12 Agile principles,"Agile is Dead, Long Live Continuous Delivery - Gradle",An operating model for company-wide agile development,An operating model for company-wide agile development
-1630229587164086350,Dries Buytaert,Drupal 8.1.0 is now available,Drupal 8 is 1 Year Old (AND YOU GET A PRIZE!),Drupal and ambitious digital experiences,The Risks and Rewards of Fully Decoupling Drupal | Acquia,"New blog from Dries: A ""MAP"" for accelerating Drupal 8 adoption"
3168079495368669052,Are Chatbots Really The Future Of Web Design?,How Facebook's Big Bet On Chatbots Might Remake The UX Of The Web,Introduction To Chatbots,Life Beyond Email: Chatbot Marketing,Is the Chatbot Trend One Big Misunderstanding?,The 200 billion dollar chatbot disruption
8384349834972693428,Python Ecosystem for Machine Learning - Machine Learning Mastery,Python Is Not Java (dirtSimple.org),Python Eats Into R as SAS Dominance Fades,5 Skills You Need to Become a Machine Learning Engineer | Udacity,Machine Learning Is No Longer Just for Experts,Auto-scaling scikit-learn with Spark
7763750328910542816,This Japanese Restaurant Is Decked out With Yakuza-Inspired Tattoo Art | Highsnobiety,How to Improve 8 Major Problem Areas for Japanese Learners of All Levels,MIT and Microsoft Research made a 'smart' tattoo that remotely controls your phone,Japanese for dummies,Learn Japanese Online | Japanese Podcast| JapaneseLingQ.com,Salesforce Architect Journey
8433131156569129937,"Predicting the future, one week at a time",Introduction to Natural Language Processing - University of Michigan | Coursera,"Practical advice for analysis of large, complex data sets",Power to the People: How One Unknown Group of Researchers Holds the Key to Using AI to Solve Real...,Power to the People: How One Unknown Group of Researchers Holds the Key to Using AI to Solve Real...,So long MVP. Hello Minimum Loveable Product.
1318981494172475806,"Google acquires Synergyse, an interactive training service for Google Apps","Google acquires Synergyse, an interactive training service for Google Apps",'Training for Google Apps' Is One Of Chrome's Best Kept Secrets - OMG! Chrome!,Google connects BigQuery to Google Drive and Sheets,Google I/O 2016 Preview: A Chrome/Android merger? Project Tango? VR?,"Google I/O 2016 Preview: Machine Learning, Virtual Reality And Android N - ARC"
-2388274433047018803,Scientists discover potentially habitable planets,"Reaching for the Stars, Across 4.37 Light-Years","Here's the first full trailer for the next Star Wars movie, Rogue One",Mining in Space Could Lead to Conflicts on Earth - Facts So Romantic - Nautilus,Melancholia (2011),The 100 (TV Series 2014- )
-7474372733748503487,"Estonia wants to become a 'country as a service' and already has 10,000 virtual residents",Why Barclays Sees Banking's Future as an Information Business,Where is the bank's digital vision? - Chris Skinner's blog,Building a digital-banking business,The surprising truth about which countries lead in digital,How to move an entire government to a new digital platform - Dries Buytaert
7877378240682678384,Qualcomm's deep learning SDK will mean more AI on your smartphone,Qualcomm Snapdragon 820 Deep Learning SDK Nudges Local Neural Nets Closer To Mainstream,The AI business landscape,Here are the SDKs Top Mobile Apps Use,Why Deep Learning Is Suddenly Changing Your Life,The Man Selling Shovels in the Machine-Learning Gold Rush
5843350704442714396,The 7 Habits of a Highly Effective Product Owner,[Select Repost] Scaling the Product Owner Role,Organizing for digital acceleration: Making a two-speed IT operating model work,9 Useful Apps for Product Managers - Product Hunt,How to overcome UX challenges with product design sprints,The Real Product Market Fit
6876740810766966100,Qualcomm Snapdragon 820 Deep Learning SDK Nudges Local Neural Nets Closer To Mainstream,Qualcomm's deep learning SDK will mean more AI on your smartphone,Why Deep Learning Is Suddenly Changing Your Life,Here are the SDKs Top Mobile Apps Use,Plug the Fathom Neural Compute Stick into any USB device to make it smarter,Apple gives devs the chance to harness power of neural networks
6980529106338478812,Why The New Chatbot Invasion Is So Different From Its Predecessors,How Facebook's Big Bet On Chatbots Might Remake The UX Of The Web,Introduction To Chatbots,Life Beyond Email: Chatbot Marketing,The 200 billion dollar chatbot disruption,You're Asking Too Much of Chat Bots. Just Let Them Grow Up
-6878119266243511199,"Google acquires Synergyse, an interactive training service for Google Apps","Google acquires Synergyse, an interactive training service for Google Apps",'Training for Google Apps' Is One Of Chrome's Best Kept Secrets - OMG! Chrome!,Google connects BigQuery to Google Drive and Sheets,Google I/O 2016 Preview: A Chrome/Android merger? Project Tango? VR?,"Google I/O 2016 Preview: Machine Learning, Virtual Reality And Android N - ARC"
-3968102273907750828,Adaptation. (2002),Boogie Nights (1997),Pi (1998),Punch-Drunk Love (2002),Enemy (2013),Mulholland Drive (2001)
-74919696966767903,Being John Malkovich (1999),Labyrinth of Lies (2014),Adaptation. (2002),Adulterated Objective-C,"Meet Bozoma Saint John, the Apple executive who stole the show at WWDC","If women in tech stop apologizing, we might just be able to shut the sexist shit down. - Athena Talks"
-7814257818245609902,Magnolia (1999),The Color of Paradise (1999),Boogie Nights (1997),Hidden (Caché) (2005),"The Cook, the Thief, His Wife & Her Lover (1989)",The Fountain (2006)
3456446200772320915,Eternal Sunshine of the Spotless Mind (2004),Hidden (Caché) (2005),Boogie Nights (1997),Mulholland Drive (2001),Downfall (2004),Pi (1998)
7569814035922103969,Once Upon a Time in the West (1968),Boogie Nights (1997),Melancholia (2011),Pi (1998),The Color of Paradise (1999),Hidden (Caché) (2005)
6569723785655740276,Let the Right One In (2008),Boogie Nights (1997),The Hateful Eight (2015),The Fountain (2006),Mulholland Drive (2001),Sympathy for Mr. Vengeance (2002)
614512039577184122,"4 Months, 3 Weeks and 2 Days (2007)",Mulholland Drive (2001),Boogie Nights (1997),Labyrinth of Lies (2014),Let the Right One In (2008),The Best Offer (2013)
6296126022971270017,Downfall (2004),Hidden (Caché) (2005),Eternal Sunshine of the Spotless Mind (2004),Wings of Desire (1987),Boogie Nights (1997),Labyrinth of Lies (2014)
-504935756748713175,Boogie Nights (1997),Let the Right One In (2008),Pi (1998),The Fountain (2006),Mulholland Drive (2001),Labyrinth of Lies (2014)
-5289386635926629588,Punch-Drunk Love (2002),The Fountain (2006),Boogie Nights (1997),The Color of Paradise (1999),Adaptation. (2002),Hidden (Caché) (2005)
3687286164936910007,Pi (1998),Boogie Nights (1997),The Fountain (2006),Eternal Sunshine of the Spotless Mind (2004),Labyrinth of Lies (2014),Nights of Cabiria (1957)
3702150017806959874,Requiem for a Dream (2000),Boogie Nights (1997),The Fountain (2006),The Color of Paradise (1999),Hidden (Caché) (2005),The Hateful Eight (2015)
-6016433871633244814,The Fountain (2006),Hidden (Caché) (2005),Boogie Nights (1997),Mulholland Drive (2001),The Hateful Eight (2015),Sympathy for Lady Vengeance (2005)
9168028029170358424,"The Cook, the Thief, His Wife & Her Lover (1989)",Hidden (Caché) (2005),Boogie Nights (1997),Magnolia (1999),The Fountain (2006),Mulholland Drive (2001)
-7684863035595645318,Wings of Desire (1987),Downfall (2004),Hidden (Caché) (2005),Boogie Nights (1997),The Fountain (2006),Magnolia (1999)
34557439830244258,Sympathy for Lady Vengeance (2005),Sympathy for Mr. Vengeance (2002),Boogie Nights (1997),Oldboy (2003),The Fountain (2006),Hidden (Caché) (2005)
6258766779968998934,Sympathy for Mr. Vengeance (2002),Sympathy for Lady Vengeance (2005),Boogie Nights (1997),Oldboy (2003),Let the Right One In (2008),The Fountain (2006)
-5345231991504930502,Oldboy (2003),Sympathy for Lady Vengeance (2005),Sympathy for Mr. Vengeance (2002),Boogie Nights (1997),Let the Right One In (2008),Eternal Sunshine of the Spotless Mind (2004)
-6056382045660082261,Melancholia (2011),Boogie Nights (1997),Enemy (2013),The Best Offer (2013),The 100 (TV Series 2014- ),Labyrinth of Lies (2014)
-4882849408937990337,Dogville (2003),Hidden (Caché) (2005),Eternal Sunshine of the Spotless Mind (2004),The Hateful Eight (2015),Boogie Nights (1997),Melancholia (2011)
-894273917655637623,Departures (2008),"The Cook, the Thief, His Wife & Her Lover (1989)",Eternal Sunshine of the Spotless Mind (2004),Hidden (Caché) (2005),Let the Right One In (2008),Boogie Nights (1997)
7078276984547732873,How Companies Are Using Machine Learning to Get Faster and More Efficient,How Leaders Can Let Go Without Losing Control,The Secret History of Agile Innovation,How CEOs Can Keep Their Analytics Programs from Being a Waste of Time,Swift Top 10 Articles For The Past Year (v.2017),The Great Library
4139191914110236238,An operating model for company-wide agile development,An operating model for company-wide agile development,Embracing Agile,"Agile is Dead, Long Live Continuous Delivery - Gradle",12 Agile principles,Organizing for digital acceleration: Making a two-speed IT operating model work
-703416562539077070,Scrum Community - Scrum Alliance,Embracing Agile,An operating model for company-wide agile development,An operating model for company-wide agile development,"Agile is Dead, Long Live Continuous Delivery - Gradle",12 Agile principles
-1706114177222872702,The Spotify Tribe,Scrum Community - Scrum Alliance,Spotify chooses Google Cloud Platform to power data infrastructure,Building a technical career path at Spotify,Spotify's Latest Algorithmic Playlist Is Full of Your Favorite New Music,Oculus acquires eye-tracking startup The Eye Tribe
7606744605433799135,Why the customer experience matters,Linking the customer experience to value,Developing a customer-experience vision,Banking Needs a Customer Experience Wake-Up Call,Using behavioral data to improve customer satisfaction,Transforming life insurance with design thinking
2672238531812965181,Improving Angular performance with 1 line of code,30 Learning Resources For Mastering Angular 2,Why Learning Angular 2 Was Excruciating,Angular 2 versus React: There Will Be Blood - Free Code Camp,johnpapa/angular-styleguide,20+ Docs and Guides for Front-end Developers (No. 9)
-6603351162010419903,VersionOne AgilelIVE™ Webinar Series| SAFe® Expert Webinar,Embracing Agile,"Agile is Dead, Long Live Continuous Delivery - Gradle",An operating model for company-wide agile development,An operating model for company-wide agile development,[Live Webinar] Measuring Enterprise Agility Best practice measures for tracking agile and DevOps performance
-1981734999963962468,Google's Cloud Dataflow stomps on Apache Spark in new benchmark tests,"Big data, big differentiators: this week on Google Cloud Platform","Google Cloud Dataproc - the fast, easy and safe way to try Spark 2.0-preview | Google Cloud Big Data and Machine Learning Blog",Spark fragmentation undermines community,Making Apache Spark Easier to Use in Java with Java 8 - Cloudera Engineering Blog,Spark comparison: AWS vs. GCP
3375733407275108717,Brazilian Government and Ericsson to innovate together for Internet of Things,Latin America's chronic inefficiency could drive more O2O commerce growth,Corporate venture growth in Brazil is another sign of a mature tech ecosystem,Tech in Brazil is booming despite the country's political troubles,Popular Internet of Things Forecast of 50 Billion Devices by 2020 Is Outdated,Meet the new Brazilian consumer
372648779227126668,Planned Death,Hintjens.com,So long MVP. Hello Minimum Loveable Product.,Google Home brings Google's smarts to your living room,8 Things Every Person Should Do Before 8 A.M. - The Mission,Introducing Ask a Female Engineer
-5820943153819992582,Google : End Of The Online Advertising Bubble,Breaking: Apple's Search Ads go LIVE!,"Telecoms open shop on Madison Avenue, but will brands buy?",State of the Digital Nation 2016,Susan Wojcicki on the Effectiveness of Empowering Ads on YouTube,Susan Wojcicki on the Effectiveness of Empowering Ads on YouTube
4917926779066818777,Hidden (Caché) (2005),The Fountain (2006),Boogie Nights (1997),Eternal Sunshine of the Spotless Mind (2004),"The Cook, the Thief, His Wife & Her Lover (1989)",Mulholland Drive (2001)
5232169374213306041,Mulholland Drive (2001),Boogie Nights (1997),Enemy (2013),Hidden (Caché) (2005),The Fountain (2006),Labyrinth of Lies (2014)
3801064060797809024,How Green Was My Valley (1941),The Color of Paradise (1999),Hidden (Caché) (2005),Nights of Cabiria (1957),"Bitcoin Mining, Ethereum Mining, Cloud Mining: 2016 Overview",Magnolia (1999)
-8686523832043452855,All About Eve (1950),Boogie Nights (1997),The Color of Paradise (1999),Mulholland Drive (2001),The Fountain (2006),Let the Right One In (2008)
-7564053678326007415,Chatbots for work: Troops raises $2.6M to help you use Salesforce,To bot or not to bot,How bot-to-bot could soon replace APIs,How will bots make money? Here are 7 business models,Introduction To Chatbots,TechCrunch launches a personalized news recommendations bot on Facebook Messenger
5508665170385092264,IBM Is Now Letting Anyone Play With Its Quantum Computer,Humans Can Still Do One Thing Better Than AI,My Quantum Circuit Simulator: Quirk,"Meet Articoolo, the robot writer with content for brains",IBM wants to bring machine learning to the mainframe,IBM makes a big shift into cognitive computing
4544213501105457932,How I got into the top 15 of a Kaggle competition in 3 days: A Python Tutorial,How to choose algorithms for Microsoft Azure Machine Learning,ŷhat | Classifying handwritten digits using TensorFlow,Approaching (Almost) Any Machine Learning Problem | Abhishek Thakur,Approaching (Almost) Any Machine Learning Problem,"Deep Learning for Chatbots, Part 2 - Implementing a Retrieval-Based Model in Tensorflow"
914293752636521893,Asia's mobile-first economy and how the West is feeling the effects,The Conversational Economy Part 1: What's Causing the Bot Craze?,"Google Cloud Platform adds two new regions, 10 more to come",Mobile marketing statistics 2016,State of the Digital Nation 2016,New Asia Trend Briefing from TrendWatching | SOCIAL SERVANTS
7255021292858609470,An operating model for company-wide agile development,An operating model for company-wide agile development,Embracing Agile,"Agile is Dead, Long Live Continuous Delivery - Gradle",12 Agile principles,Organizing for digital acceleration: Making a two-speed IT operating model work
2491414153837906223,A Royal Affair (2012),Labyrinth of Lies (2014),Melancholia (2011),Boogie Nights (1997),Incendies (2010),Pi (1998)
1719976830095479814,Bicycle Thieves (1948),The Science of Cycology,Why Thieves Steal Soap,The Color of Paradise (1999),Boogie Nights (1997),Pi (1998)
-6275771337261603227,Nights of Cabiria (1957),Boogie Nights (1997),Pi (1998),Hidden (Caché) (2005),Bicycle Thieves (1948),Mulholland Drive (2001)
764116021156146784,"If you think women in tech is just a pipeline problem, you haven't been paying attention - Tech Diversity Files",Equal Pay Day in the spotlight this year,"In war for talent, 'brogrammers' will be losers",Glamour Exclusive: President Obama On Feminism and The World He Wants to Leave His Daughters,The best-and worst-places to be a working woman,Susan Wojcicki on the Effectiveness of Empowering Ads on YouTube
7572869304086387835,The White House Has Realized Artificial Intelligence Is Very Important,Request for Information: Preparing for the Future of Artificial Intelligence,Here's how The White House wants the U.S. to approach AI R&D,Clarifying the uses of artificial intelligence in the enterprise,When Is the Singularity? Probably Not in Your Lifetime,The next AI is no AI
-4944551138301474550,Algorithms and architecture for job recommendations,Java vs .NET vs Python vs Ruby vs Node.JS: Who Reigns the Job Market? | Takipi Blog,Today in Apple history: World prepares for the NeXT Computer | Cult of Mac,Today in Apple history: Steve Jobs passes away | Cult of Mac,Today in Apple history: Steve Jobs passes away | Cult of Mac,Automation and anxiety
-5579492244806284582,"[Tools] Personal Kanban in ""Favro""",[Kanban Boards] Is Pinnery the Better Trello?,[Tools] A Tool for tracking Kanban projects (that you can cut out and keep) - Emily Webber,We spent a week making Trello boards load extremely fast. Here's how we did it.,Java Collections Cheat Sheet,8 Insanely Simple Productivity Hacks
49177526672934036,After a year of using NodeJS in production,Node.js Examples - How Enterprises use Node in 2016 | @RisingStack,The Top 10 Most Common Mistakes That Node.js Developers Make,Node.js Best Practices - How to Become a Better Developer in 2017 | @RisingStack,Four Node.js Gotchas that Operations Teams Should Know about - The New Stack,Promises | Web Fundamentals - Google Developers
-6324550271415246022,4 Strategies for Mastering UX in Virtual Reality Games,VR possibilities at Google I/O 2016: Four things I'm hoping to see,Still a virtual reality skeptic? Here's why you shouldn't be,Can virtual reality revolutionise education?,"Rumor: ""Android VR"" Will Launch At I/O With Standalone Headset, Reference Appears In Unreal Engine",Google may unveil Android VR headset at I/O conference
300937643051923212,Mimo baby monitor helps parents get more sleep,How Mobile Health Apps and Wearables Could Actually Make People Sicker,Half Your Brain Stands Guard When Sleeping In A New Place,"Millennials Don't Care About Owning Cars, And Car Makers Can't Figure Out Why",8 Things Every Person Should Do Before 8 A.M. - The Mission,Having Children Destroyed My Career
-9055044275358686874,Accept questions from your audience when presenting in Google Slides,"Opening Google Docs, Sheets, and Slides files on mobile now easier when you're offline","Choose the Google Docs, Sheets, and Slides files you want to access offline",Dial in with ease using the latest Google Calendar app for Android,Embed charts from Google Sheets in Google Docs and Slides and update them with a single click,"Explore in Docs, Sheets and Slides makes work a breeze - and makes you look good, too"
3980405883168341377,"Apple, Set to Move to Its Spaceship, Should Try More Moonshots",An Exclusive Look at How AI and Machine Learning Work at Apple - Backchannel,What to Expect at WWDC 2016,WWDC 2016 preview: How to watch &amp; what to expect at Apple's event on Monday,Apple's secret strategy: Underpromise and overdeliver,Today in Apple history: 'Here's to the crazy ones...' | Cult of Mac
-2208293144000550811,Docker Cleanup Scripts Comparison,Containers - Clean up your House,"Use Docker to build, test and push your Artifacts",Your Docker Agenda for April,A Docker Fork: Talk of a Split Is Now on the Table - The New Stack,Docker Engine 1.11 with runC: Announcing the general availability of the industry's first OCI-compliant runtime
6424668376409530281,Docker inside docker and overview about Jenkins 2,Drupal 8 CI/CD with Docker via Jenkins. Part 1: Integration,A Docker Fork: Talk of a Split Is Now on the Table - The New Stack,"Use Docker to build, test and push your Artifacts",Your Docker Agenda for April,Automate Docker with the Remote API and Ruby
2589533162305407436,6 reasons why I like KeystoneML,Doing Data Science Right - Your Most Common Questions Answered,Building a high-throughput data science machine,"The ""Joel Test"" for Data Science",Engineers Shouldn't Write ETL: A Guide to Building a High Functioning Data Science Department,5 Skills You Need to Become a Machine Learning Engineer | Udacity
-8700857105739861338,"Forget Wallets, Check out This Serious FinTech Product Built in India: ZestMoney for Instant Credit",Final is a plaster on the gaping wound that is U.S. credit card security,Why your wallet is becoming the next platform,Failing model: Plastic Card + App and Card + Wallet Players?,"Amazon looking to buy Capital One? "" Banking Technology","Say goodbye to traditional customer segmentation "" Banking Technology"
9220445660318725468,Angular 2,Hero unveils a new home gadget to help you track and dispense pills,30 Learning Resources For Mastering Angular 2,Angular 2 versus React: There Will Be Blood - Free Code Camp,How to make Multi-Layered Parallax Illustration with CSS & Javascript,Inversion of Control Containers and the Dependency Injection pattern
-7891960098457323262,"Dag Kittlaus, co-founder of Siri, will give the world's first demo of a next gen AI called Viv at Disrupt NY","Here's what Viv looks like, the next generation AI assistant built by Siri creator","Siri: Once a Flake, Now Key to Apple's Future",Why 2016 is shaping up to be the Year of the Bot,An Exclusive Look at How AI and Machine Learning Work at Apple - Backchannel,13 Game-changing Artificial Intelligence Startups
-1852234953549915446,The Color of Paradise (1999),Magnolia (1999),Boogie Nights (1997),Waking Ned Devine (1998),Touch (TV Series 2012-2013),Hidden (Caché) (2005)
-8041742992841055506,Enemy (2013),The Best Offer (2013),Mulholland Drive (2001),Boogie Nights (1997),Melancholia (2011),Pi (1998)
3720742491238027703,29 Common Google Analytics Data Errors And How To Fix Them,The Complete Google Analytics Audit Checklist | Optimization Up,Improvements coming to the Google Analytics desktop UI,The need to lead in data and analytics,Using Google Analytics with Leadfeeder for B2B Lead Generation,Introducing the Google Analytics Demo Account for Learning
-5570129644089964821,Design Kit: Prototyping,Time to Re-Think Design Thinking,What exactly is a design culture? ,The Future of Business is Design,[E-learning] Design Thinking for Innovation - University of Virginia | Coursera,[Free Course] Running Valuable Design Sprints - University of Virginia | Coursera
1433951803438448289,"Creative partnerships: Machine learning and the future of design - O'Reilly Media Free, Live Events",Machine Learning for Designers,5 Skills You Need to Become a Machine Learning Engineer | Udacity,How real businesses are using machine learning,Machine Learning Is No Longer Just for Experts,"How Google is Remaking Itself as a ""Machine Learning First"" Company - Backchannel"
541470630329465127,"Chatbots Are Your Newest, Dumbest Co-Workers",Introduction To Chatbots,To bot or not to bot,How will bots make money? Here are 7 business models,What the future will look like when we use chatbots instead of apps,Why 2016 is shaping up to be the Year of the Bot
1698483880714927645,"Google's AI engine is reading 2,865 romance novels to be more conversational",Google's artificial intelligence is going in the wrong direction,You're Asking Too Much of Chat Bots. Just Let Them Grow Up,Google Cloud Platform: The smart person's guide - TechRepublic,​Google digs deeper on machine learning with new European research lab,"Google Sprints Ahead in AI Building Blocks, Leaving Rivals Wary"
-6542996094878850014,How One Jira Ticket Made My Employer $1MM/Month: 7 Metrics that Actually Matter - JavaScript Scene,12 Agile principles,Do you want Crappy Agile?,Embracing Agile,The Joel Test: 12 Steps to Better Code,So long MVP. Hello Minimum Loveable Product.
5051167660880461112,Google Cloud and Autodesk enable 10x improvement in media rendering efficiency,Google Cloud Platform: The smart person's guide - TechRepublic,What's the Best Cloud? Probably GCP,"Google Cloud Machine Learning family grows with new API, editions and pricing",Google Cloud Platform sets a course for new horizons,"Introducing Cloud Natural Language API, Speech API open beta and our West Coast region expansion"
8295457724580096419,The Startup Zeitgeist,Blockchain CEO's Business Advice on Bitcoin Startups,Building on Slack Saved Our Startup,Slack and Google announce partnership focused on better integrating their services,How people using Slack to organise their grocery lists is helping it grow,Are you a bitcoin denialist? - Chris Skinner's blog
-8510490754427841940,How a Chatbot Helped This Vinyl Records Startup Make $1 Million in 8 Months,Life Beyond Email: Chatbot Marketing,Chatbots are revolutionizing customer support,How Facebook's Big Bet On Chatbots Might Remake The UX Of The Web,The 200 billion dollar chatbot disruption,A new Facebook chatbot could help you find your next job - Digiday
-8722526817358894474,VR possibilities at Google I/O 2016: Four things I'm hoping to see,"Rumor: ""Android VR"" Will Launch At I/O With Standalone Headset, Reference Appears In Unreal Engine",Google may unveil Android VR headset at I/O conference,Still a virtual reality skeptic? Here's why you shouldn't be,4 Strategies for Mastering UX in Virtual Reality Games,Can virtual reality revolutionise education?
6910763794618680440,JavaServer Faces 2.3 Quick Reference - DZone Java,Inversion of Control Containers and the Dependency Injection pattern,Tasting Dagger 2 on Android,Exploring Java's Hidden Costs,Test Driven Development by Example: Validation in Java,Java 8 Streams - A Deeper Approach About Performance Improvement
