ArticleID,ArticleTitle,Rec1,Rec2,Rec3,Rec4,Rec5
1525988103928186217,Of prediction and policy,5 Skills You Need to Become a Machine Learning Engineer | Udacity,Machine Learning for Designers,Artificial Intelligence's White Guy Problem,Machine Learning Is No Longer Just for Experts,How real businesses are using machine learning
-48321713734223478,The new paradigm for human-bot communication,To bot or not to bot,Introduction To Chatbots,How will bots make money? Here are 7 business models,How bot-to-bot could soon replace APIs,How to Start a Telegram Bot With PHP
7372398343609401828,Bitcoin / Blockchain,Are you a bitcoin denialist? - Chris Skinner's blog,"For Blockchain VCs, the Time for Ethereum Investments Has Come - CoinDesk",Ethereum and Bitcoin Are Market Leaders But Not Competitors,Stratumn is building a sort of Heroku for blockchain applications - The Bitcoin Channel,Blockchain CEO's Business Advice on Bitcoin Startups
5998661158461710046,"Chatbot lawyer overturns 160,000 parking tickets in London and New York",11 incredible ways UK businesses are using chatbots,Here's 6 helpful chatbots that prove conversation machines can do more than just talk,SpotHero is ready for the future of autonomous parking,Introduction To Chatbots,How Facebook's Big Bet On Chatbots Might Remake The UX Of The Web
-3959242148361340089,Gartner Reprint,Gartner Reprint,The Hardest Part About Microservices: Your Data,"Amazon still crushing cloud competition, says Gartner Magic Quadrant for IaaS - TechRepublic",Organizing for digital acceleration: Making a two-speed IT operating model work,The Definitive Guide to Database Version Control
-1137602700803601559,Polly.ai raises $1.2 million to help companies poll their employees,Building on Slack Saved Our Startup,Slack and Google announce partnership focused on better integrating their services,How people using Slack to organise their grocery lists is helping it grow,Slack raises $200m at $3.8b valuation for business messaging,IBM Watson is about to make Slack's chat bot smarter
6340108943344143104,Text summarization with TensorFlow,Announcing SyntaxNet: The World's Most Accurate Parser Goes Open Source,Machine Learning is Fun! Part 2,Celebrating TensorFlow's First Year,Machine Learning for Designers,Announcing TensorFlow 0.8 - now with distributed computing support!
5312357518363318341,Apple's Machine Learning Has Cut Siri's Error Rate by a Factor of Two,An Exclusive Look at How AI and Machine Learning Work at Apple - Backchannel,"Apple, Set to Move to Its Spaceship, Should Try More Moonshots",Apple Hiring for New Machine Learning Division Following Turi Acquisition,What to Expect at WWDC 2016,"Siri: Once a Flake, Now Key to Apple's Future"
-5686522658459155544,[Tools] Trello Custom Fields: How To Maximize Your Board Workflow - Trello Blog,How to create Trello cards from Slack.,Trello Is Being Acquired By Atlassian,[Kanban Boards] Is Pinnery the Better Trello?,Using Display Suite in Drupal 8: How to Customize Content Pages - WebWash,Mark A Trello Card As Done (And Drop The Mic On That Task)
-5802731238371220572,An introduction to Generative Adversarial Networks (with code in TensorFlow),Generative Models,"Deep Learning for Chatbots, Part 1 - Introduction","Deep Learning for Chatbots, Part 2 - Implementing a Retrieval-Based Model in Tensorflow",Power to the People: How One Unknown Group of Researchers Holds the Key to Using AI to Solve Real...,Power to the People: How One Unknown Group of Researchers Holds the Key to Using AI to Solve Real...
-3450690190989108770,Why AI consolidation will create the worst monopoly in US history,"Apple acquires Turi, a machine learning company",Apple Acquires Machine Learning Company Turi For $200 Million,Apple Hiring for New Machine Learning Division Following Turi Acquisition,Andrew Ng: What AI Can and Can't Do,Here's how The White House wants the U.S. to approach AI R&D
307952468886079288,Apple Adds to Vintage Software Collection With eBay Purchase,"Apple, Set to Move to Its Spaceship, Should Try More Moonshots",An Exclusive Look at How AI and Machine Learning Work at Apple - Backchannel,Today in Apple history: 'Here's to the crazy ones...' | Cult of Mac,WWDC 2016 preview: How to watch &amp; what to expect at Apple's event on Monday,What to Expect at WWDC 2016
6384824828701919724,14 Cool Drupal 8 modules for site builders | August 2016,Dries Buytaert,Drupal 8.1.0 is now available,Choosing Modules and Themes for Drupal 8,Drupal 8 is 1 Year Old (AND YOU GET A PRIZE!),The Risks and Rewards of Fully Decoupling Drupal | Acquia
-7162567255723313045,Chatbots: Are they better without the chat?,Introduction To Chatbots,How Facebook's Big Bet On Chatbots Might Remake The UX Of The Web,What the future will look like when we use chatbots instead of apps,CHATBOTS EXPLAINED: Why businesses should be paying attention to the chatbot revolution,Life Beyond Email: Chatbot Marketing
8259682769688682084,Containers - Clean up your House,Automate Docker with the Remote API and Ruby,A Docker Fork: Talk of a Split Is Now on the Table - The New Stack,"Use Docker to build, test and push your Artifacts",Your Docker Agenda for April,Why You Should Stop Installing Your WebDev Environment Locally - Smashing Magazine
-4707863452603278075,"PSA: iOS 9.3.5 fixes serious security exploit that exposed contacts, texts, calls, &amp; emails","Apple Releases iOS 10 With Redesigned Lock Screen, New Messages Features, Third-Party Siri, and More",Top 100 Best Blogs for iOS Developers to Learn and Gain Insights,What to Expect at WWDC 2016,Google I/O 2016: Android's failure to innovate hands a Apple free run at WWDC,WWDC 2016 preview: How to watch &amp; what to expect at Apple's event on Monday
-2271000159302779222,The moment when you realize every server in the world is vulnerable - Free Code Camp,How to write a Bloom filter in C++,Enable secure mode on your web product | Intercom Docs,Our password hashing has no clothes,Customer Supplied Encryption Keys in Cloud Storage now in beta,Algorithms and architecture for job recommendations
4036103329046553070,"SpaceNet satellite imagery repository launched by DigitalGlobe, CosmiQ Works and NVIDIA on AWS",What Happens When You Combine Artificial Intelligence and Satellite Imagery,Why image recognition is about to transform business,Nvidia announces a supercomputer aimed at deep learning and AI,The barbell effect of machine learning.,This startup uses machine learning and satellite imagery to predict crop yields
3268827390679661574,Video: Steve Wozniak discusses the importance of education,Today in Apple history: Happy birthday Steve Wozniak,Today in Apple history: Steve Jobs passes away | Cult of Mac,Today in Apple history: Steve Jobs passes away | Cult of Mac,Today in Apple history: Steve Jobs resigns as Apple CEO,Today in Apple history: World prepares for the NeXT Computer | Cult of Mac
-6940659689413147290,An Exclusive Look at How AI and Machine Learning Work at Apple - Backchannel,Apple's Machine Learning Has Cut Siri's Error Rate by a Factor of Two,"Apple, Set to Move to Its Spaceship, Should Try More Moonshots",What to Expect at WWDC 2016,"Siri: Once a Flake, Now Key to Apple's Future",WWDC 2016 preview: How to watch &amp; what to expect at Apple's event on Monday
957332268361319692,Tasting Dagger 2 on Android,Inversion of Control Containers and the Dependency Injection pattern,Advanced Android Espresso,Android process death - and the (big) implications for your app - Inloop,Exploring Java's Hidden Costs,The hardest thing in computer science
1487738553913510703,98 personal data points that Facebook uses to target ads to you,Facebook at Work pushed to 'later this year',How Mark Zuckerberg Led Facebook's War to Crush Google Plus,How Facebook's Big Bet On Chatbots Might Remake The UX Of The Web,"Facebook ditches Bing, 800M users now see its own AI text translations","Facebook's New Mobile Test Framework Births Bottom Tab Bar Navigation Redesign For iOS 5, 6, & 7"
-2430889785264760757,Top 100 Best Blogs for iOS Developers to Learn and Gain Insights,Why porting an iOS design to Android will not work,"Apple Releases iOS 10 With Redesigned Lock Screen, New Messages Features, Third-Party Siri, and More",Developing iOS 9 Apps with Swift - Curso grátis de Stanford no iTunes U,Visual Studio Code Now Supports Debugging of iOS Web Apps,"Facebook's New Mobile Test Framework Births Bottom Tab Bar Navigation Redesign For iOS 5, 6, & 7"
-6810247170272691501,[Tools] Universities should ban PowerPoint - It makes students stupid and professors boring,Accept questions from your audience when presenting in Google Slides,[Tools] XMind Plus - Last Chance for students' 1$ gift,New Google Cloud Platform Education Grants offer free credits to students,Creative Applications of Deep Learning with TensorFlow | Kadenze,Code.org 2016 Annual Report
-1291869519847635026,Learning How to Learn: The Most Important Developer Skill - Free Code Camp,Machine Learning for Designers,7 Tips to Create a Company Learning Culture like Google - Without Resources,5 Skills You Need to Become a Machine Learning Engineer | Udacity,Machine Learning is Fun!,"How Google is Remaking Itself as a ""Machine Learning First"" Company - Backchannel"
1060159005880386235,Internet of Things Drives Outcome-Based Business Models,How CIOs Leverage Business Intelligence to Drive Smarter Decision-Making,Five questions boards should ask about IT in a digital world,How enterprise architects can help ensure success with digital transformations,7 Questions to Ask Before Your Next Digital Transformation,The economic essentials of digital strategy
4125609302375934769,Cracks are showing in Uber but the company coming out of the shell is not what you thought,Uber China will reportedly merge with archrival Didi Chuxing,Uber's first self-driving cars will start picking up passengers this month,In defense of the Uber-ization of everything,Why Uber Is Killing the Bank (And What That Means for Everything Else),"Slack and Uber's parting proves when apps unite, it isn't always a smooth ride"
6472331784294749716,10 Breakthrough Technologies 2016: DNA App Store,Microsoft and University of Washington researchers set record for DNA storage - Next at Microsoft,Cello,A programming language for living cells,Copyrighting DNA Is a Bad Idea,"The New App Store: Subscription Pricing, Faster Approvals, and Search Ads"
9112765177685685246,Scott Penrose: Arduino Static Strings,Optimize Arduino Memory Usage,What to look for in a code review ,The technology behind preview photos,Real World Swift Performance,Exploring Java's Hidden Costs
521382866757596943,Optimize Arduino Memory Usage,Scott Penrose: Arduino Static Strings,Real World Swift Performance,Facebook Thinks It Has Found the Secret to Making Bots Less Dumb,Type-based aliasing in C,Why Erlang Matters
4631867115963052211,"Apple announces 'iPhone 7' September 7 event, Apple Watch 2 and MacBook Pros may be unveiled",Apple Invites Media to September 7 Event: 'See You on the 7th',MacBook Pro Lineup Set For 'Most Significant Overhaul in Over 4 Years',What to Expect at WWDC 2016,WWDC 2016 preview: How to watch &amp; what to expect at Apple's event on Monday,"Apple unveils the new iPhone 7, preorder now, available 9/16"
-5823763419123575797,Apple Invites Media to September 7 Event: 'See You on the 7th',"Apple announces 'iPhone 7' September 7 event, Apple Watch 2 and MacBook Pros may be unveiled",What to Expect at WWDC 2016,WWDC 2016 preview: How to watch &amp; what to expect at Apple's event on Monday,Apple Invites Media to 'Hello Again' October 27th Mac-Centric Event,"Apple unveils the new iPhone 7, preorder now, available 9/16"
-3395906801262755897,CHATBOTS EXPLAINED: Why businesses should be paying attention to the chatbot revolution,Introduction To Chatbots,How Facebook's Big Bet On Chatbots Might Remake The UX Of The Web,What the future will look like when we use chatbots instead of apps,The 200 billion dollar chatbot disruption,Chatbots: Are they better without the chat?
-8704908797766843570,A Docker Fork: Talk of a Split Is Now on the Table - The New Stack,Your Docker Agenda for April,Docker Engine 1.11 with runC: Announcing the general availability of the industry's first OCI-compliant runtime,Containers - Clean up your House,Docker Swarm,"Use Docker to build, test and push your Artifacts"
-1483274517395674620,Test and deploy to Google App Engine with the new Maven and Gradle plugins,Expanding our IDE support with a new Eclipse plugin for App Engine,8 must-see sessions for application developers at Google Cloud Next '17,Google Cloud Platform: The smart person's guide - TechRepublic,How to use Docker to run ASP.NET Core apps on Google App Engine,Release Day: Extend Drupal 8 with Plugins
4674667995387386186,"Waterwheel, the Drupal SDK Ecosystem",Improving Drupal 8's API-first: JSON API and OAuth2?,The Risks and Rewards of Fully Decoupling Drupal | Acquia,Dries Buytaert,New blog from Dries: How should you decouple Drupal?,Drupal 8.1.0 is now available
-1870456025059842373,Blockchain Huge Potential For The Insurance Industry,How Blockchain Technology Can Improve the Insurance Industry,The Blockchain is the new Google,Top 10 Insurtech Trends for 2017 - Insurance Thought Leadership,The insurance tech equation,From fine wine to lotteries: Blockchain tech takes off - BBC News
-1249582672736761858,Sweden's Greta wants to disrupt the multi-billion dollar CDN market,Google CDN Beta is here... and it's already one of the fastest CDNs out there!,Dries Buytaert,Performance Testing in a Nutshell,Load Testing Our Site on Pantheon (Drupalize.me),"Front-End Performance Checklist 2017 (PDF, Apple Pages) - Smashing Magazine"
7508152369854945139,Introducing Casting into Hangouts,Dial in with ease using the latest Google Calendar app for Android,Stay focused with Google Calendar event notifications in your browser,'Training for Google Apps' Is One Of Chrome's Best Kept Secrets - OMG! Chrome!,"Choose the Google Docs, Sheets, and Slides files you want to access offline",New settings for 2-Step Verification
8844011188151156774,TF-Slim: A high level library to define complex models in TensorFlow,Announcing TensorFlow 0.8 - now with distributed computing support!,TensorFlow Tutorial- Part 1,"Deep Learning for Chatbots, Part 2 - Implementing a Retrieval-Based Model in Tensorflow",Google launches distributed version of its TensorFlow machine learning system,Show and Tell: image captioning open sourced in TensorFlow
-5488842573681626972,BDD Best Practices and Guidelines - Testing Excellence,"Opening Google Docs, Sheets, and Slides files on mobile now easier when you're offline",When to make a Git Commit,"Choose the Google Docs, Sheets, and Slides files you want to access offline",Build Quality In: The Key to Continuous Delivery in Kanban,Git Large File Storage (Git LFS) now in Bitbucket Cloud - Bitbucket
9042192299854648021,Google's cloud platform is now a force to be reckoned with,What's the Best Cloud? Probably GCP,Google Cloud Platform: The smart person's guide - TechRepublic,8 must-see sessions for application developers at Google Cloud Next '17,Google lags behind Amazon and Microsoft's cloud in one important area,Spotify chooses Google Cloud Platform to power data infrastructure
-3170829374166745427,[Article] 23 fascinating diagrams reveal how to negotiate with people around the world,Unilever: The biggest digital start-up in the world?,[Coursera] Introduction to Communication Science - University of Amsterdam | Coursera,Six iconic retailers and their digital transformation journeys,What Science Tells Us About Leadership Potential,What Science Tells Us About Leadership Potential
1146823593746606655,Apple Hiring for New Machine Learning Division Following Turi Acquisition,"Apple acquires Turi, a machine learning company",Apple Acquires Machine Learning Company Turi For $200 Million,An Exclusive Look at How AI and Machine Learning Work at Apple - Backchannel,Apple's Machine Learning Has Cut Siri's Error Rate by a Factor of Two,Why AI consolidation will create the worst monopoly in US history
1549650080907932816,Spark comparison: AWS vs. GCP,What's the Best Cloud? Probably GCP,"Google Cloud Dataproc - the fast, easy and safe way to try Spark 2.0-preview | Google Cloud Big Data and Machine Learning Blog",AWS Certified Solutions Architect Professional – Study Guide – Domain 8.0: Cloud Migration and Hybrid Architecture (10%),Google Cloud Platform for AWS Professionals,Google lags behind Amazon and Microsoft's cloud in one important area
7187598944032799890,Top 15 Facebook Open Source Projects You Must Know,HHVM vs PHP 7 - The Competition Gets Closer - Kinsta,Enterprise Open Source Programs Flourish -- In Tech and Elsewhere,"Open Source Won. So, Now What?","Facebook details its company-wide machine learning platform, FBLearner Flow",BrowserLab: Automated regression detection for the web
1553114235264483780,How a Japanese cucumber farmer is using deep learning and TensorFlow | Google Cloud Big Data and Machine Learning Blog | Google Cloud Platform,Celebrating TensorFlow's First Year,Google launches distributed version of its TensorFlow machine learning system,Machine Learning is Fun! Part 3: Deep Learning and Convolutional Neural Networks,Why Deep Learning Is Suddenly Changing Your Life,"How Google is Remaking Itself as a ""Machine Learning First"" Company - Backchannel"
3495098006178009360,A Googler analyzed a billion files to settle the programming dispute made famous by HBO's 'Silicon Valley',"Tabs vs Spaces: How They Write Java at Google, Twitter, Mozilla and Pied Piper | Takipi Blog",The Ten Commandments of Egoless Programming,"""Eat, sleep, code, repeat"" is such bullshit - Signal v. Noise",Being A Developer After 40 - Free Code Camp,What's the Best Programming Language to Learn in 2017?
385212706171385893,Don Tapscott: How the blockchain is changing money and business,The Blockchain is the new Google,From fine wine to lotteries: Blockchain tech takes off - BBC News,"IBM Wants to ""Evolve the Internet"" With Blockchain Technology",Blockchain Huge Potential For The Insurance Industry,Banks find blockchain hard to put into practice - FT.com
90383487344892230,Building Spring Cloud Microservices That Strangle Legacy Systems,Java Microservices: The Cake is a Lie but You Can't Ignore It | Takipi Blog,"Microservices Reference Architecture, Part 4 -12‑Factor App",Standing on the Shoulders of Giants - Built to Adapt,Using Microservices Architecture as API Enablement Strategy,Microservices: Real Architectural Patterns
4241385837165861843,Understanding the Twitter topic Tracker,Twitter adds a button to help you train its algorithm,Machine Learning and the VP Debate,The door for new contributors to Drupal is still locked,The investment case for employing a Drupal core contributor - Dries Buytaert,The Complete Google Analytics Audit Checklist | Optimization Up
-793729620925729327,Closure Compiler in JavaScript,What the JIT!? Anatomy of the OpenJDK HotSpot VM,Android - The dark side of Jack and Jill,Java 8 Streams - A Deeper Approach About Performance Improvement,You SHOULD Learn Vanilla JavaScript Before JS Frameworks - Snipcart,New JavaScript library brings Java to browsers without applets
8789407896263306493,VISA to Test Blockchain Payments among Banks; a SWIFT Rival?,Blockchain Will Be Used By 15% of Big Banks By 2017,Visa Introduces NFC-Enabled Payment Ring for Team Visa Sponsored Athletes to Use at Rio 2016 Olympic Games,Microsoft Strikes Partnership With Banks on Blockchain Tech,I've got standards - which one do you want? [UPDATE 5 APRIL 2016],Blockchain startup R3 cuts fund-raising target to $150 million: source
-3077386995956755130,Startup uses deep learning to let you shop for items by snapping photos,Google Is About to Supercharge Its TensorFlow Open Source AI,Machine Learning is Fun! Part 3: Deep Learning and Convolutional Neural Networks,Why Deep Learning Is Suddenly Changing Your Life,Why image recognition is about to transform business,Google DeepMind researchers built a deep-learning system capable of learning from very little data.
-519908173368613957,8 Best Machine Learning Cheat Sheets,5 Skills You Need to Become a Machine Learning Engineer | Udacity,How real businesses are using machine learning,Stop Coding Machine Learning Algorithms From Scratch - Machine Learning Mastery,Machine Learning Is No Longer Just for Experts,Machine learning is a poor fit for most businesses
5250363310227021277,"How Google is Remaking Itself as a ""Machine Learning First"" Company - Backchannel","How Google is Remaking Itself as a ""Machine Learning First"" Company - Backchannel",How real businesses are using machine learning,Google's Cloud Machine Learning service is now in public beta,Machine Learning Is No Longer Just for Experts,5 Skills You Need to Become a Machine Learning Engineer | Udacity
-6523871595334455509,"CSP Is Dead, Long Live CSP! On the Insecurity of Whitelists and the Future of Content Security Policy","DevOps security requires new mindset and tools for visibility, automation",Evaluating the security of Drupal contrib modules,Dries Buytaert,Making your business fit for the future,"The Three R's of Enterprise Security: Rotate, Repave, and Repair - Built to Adapt"
-8489944755890710748,It's Official: 68 Million Dropbox Account Details Leaked Online,Better together: New Microsoft integrations for easier collaboration,360 million reasons to destroy all passwords - Free Code Camp,"Dropbox open-sources Lepton, a compression algorithm that cuts JPEG file size by 22%",Recently confirmed Myspace hack could be the largest yet,Our password hashing has no clothes
9060231864899459154,Making digital strategy a reality in insurance,The insurance tech equation,Transforming life insurance with design thinking,Top 10 Insurtech Trends for 2017 - Insurance Thought Leadership,7 Questions to Ask Before Your Next Digital Transformation,The economic essentials of digital strategy
-1755875383603052680,Why Are CMOs Dropping Like Flies?,Where is the bank's digital vision? - Chris Skinner's blog,7 Questions to Ask Before Your Next Digital Transformation,The surprising truth about which countries lead in digital,Digital Leadership Is Not an Optional Part of Being a CEO,State of the Digital Nation 2016
1333053624108726661,Best Practices for using Elastic IPs (EIP) and Availability Zones,AWS Certified Solutions Architect Professional – Study Guide – Domain 1.0 – High Availability and Business Continuity (15%),Google Cloud Platform for AWS Professionals,AWS Certified Solutions Architect Professional – Study Guide – Domain 4.0: Network Design for a complex large scale deployment (10%),Kubernetes,Setting Up HTTP(S) Load Balancing
1106203543388094548,What 2 Years of Android Development Have Taught Me the Hard Way - Thought's by Aritra Roy,Why porting an iOS design to Android will not work,"What's new in Android: the N-Release, Virtual Reality, Android Studio 2.2 and more | Android Developers Blog",Android Studio 2.2,Novidades do Android Studio 2.2,Android Studio 2.0 | Android Developers Blog
-7620438371471449873,The emerging Darwinian approach to analytics and augmented intelligence,Stop Coding Machine Learning Algorithms From Scratch - Machine Learning Mastery,How to choose algorithms for Microsoft Azure Machine Learning,Machine Learning as a Service: How Data Science Is Hitting the Masses,"The future of machine learning: 5 trends to watch around algorithms, cloud, IoT, and big data - GeekWire",Lessons from Becoming a Data-Driven Organization
1021946628105173582,Introducing the Google Analytics Demo Account for Learning,Improvements coming to the Google Analytics desktop UI,The need to lead in data and analytics,29 Common Google Analytics Data Errors And How To Fix Them,Google Play Books Now Analyzes Your Reading Habits and Recommends New Books,The Complete Google Analytics Audit Checklist | Optimization Up
-326357109758599578,Chatbots are revolutionizing customer support,The 200 billion dollar chatbot disruption,Linking the customer experience to value,Developing a customer-experience vision,Why the customer experience matters,Life Beyond Email: Chatbot Marketing
-6902744509271060072,Adobe CQ/Adobe AEM,AEM 6.1 Package Manager Metadata Files,Adobe CQ/Adobe AEM,Adobe CQ/Adobe AEM,Workspace Filter,Dries Buytaert
4916417766268744775,[GTD] Forget About Setting Goals. Focus on This Instead.,"Goal Setting: Don't Lose Motivation! "" Mind Tools Blog",Introducing Goals in Google Calendar on Android and iPhone,Google Calendar's newest feature uses machine learning to help you actually accomplish your goals,Picture a Better You: How Google Calendar Uses Illustration to Help You Reach Your Goals - Google Design,8 Insanely Simple Productivity Hacks
-4201751526335049119,Bring a dinosaur to life with Watson IoT Platform and Node-RED,Intel's internal IoT platform for real-time enterprise analytics,Comparing IoT Platforms: Compare 4 IoT platform for IoT projects,Decentralizing IoT networks through blockchain,IoT Day: A timeline of how IoT is changing the world (infographic),Relating a Problem Definition to IoT Architecture | Intel® Software
-5446204508747882127,bliki: StranglerApplication,The compelling case to replace a 40-year old core system - Chris Skinner's blog,12 Agile principles,[Google4Work] Create a Tree View of your Google Drive,Good Software Takes Ten Years. Get Used To it.,Taking Microservices Home - NGINX
8065912276310959188,Will Google NLI kill the market? Linguistic APIs review,"Introducing Cloud Natural Language API, Speech API open beta and our West Coast region expansion","Google Cloud Machine Learning family grows with new API, editions and pricing",Most Interesting APIs in 2016: Cognitive Computing,Android Mobile Vision restores operation and adds Text API | Android Developers Blog,Rating the English Proficiency of Countries and Industries Around the World
