ArticleID,ArticleTitle,Rec1,Rec2,Rec3,Rec4,Rec5
-3883591366197282127,Generative Models,An introduction to Generative Adversarial Networks (with code in TensorFlow),"Deep Learning for Chatbots, Part 1 - Introduction",Machine Learning is Fun! Part 3: Deep Learning and Convolutional Neural Networks,Introducing the Open Images Dataset,Bayesian machine learning
-1737937277055036780,How We Got on Product Hunt Without ANY Preparation & the Gobs of Money We Made,9 Useful Apps for Product Managers - Product Hunt,"Franz - from idea to 10,000 daily active users in 26 days - Meet Franz",[Select Repost] Scaling the Product Owner Role,So long MVP. Hello Minimum Loveable Product.,Building on Slack Saved Our Startup
8620166073102656574,One weird trick that will change the way you code forever: JavaScript TDD,Clean Coder Blog,Leveling Up Your JavaScript -,Cookbook,7 Mistakes Most Beginners Make When A/B Testing,Firebase Test Lab for Android
-8757701761088346244,Promises | Web Fundamentals - Google Developers,After a year of using NodeJS in production,What Color is Your Function?,How it feels to learn Javascript in 2016,Leveling Up Your JavaScript -,The Top 10 Most Common Mistakes That Node.js Developers Make
8267509427016592713,The Art Of Layout Testing With Galen Framework - Smashing Magazine,Leveling Up Your JavaScript -,One weird trick that will change the way you code forever: JavaScript TDD,Cookbook,7 Mistakes Most Beginners Make When A/B Testing,Clean Coder Blog
1772786465683785304,It's Time to Unlearn Everything You Know About Java Exceptions | Takipi Blog,"Tabs vs Spaces: How They Write Java at Google, Twitter, Mozilla and Pied Piper | Takipi Blog",Monitor your application errors with Stackdriver Error Reporting,After a year of using NodeJS in production,Java 8 Streams - A Deeper Approach About Performance Improvement,Debugging WordPress: 11 Powerful Tips and Techniques
-8467102776052559275,Creating Your Code Review Checklist - DaedTech,Effective learning through code workshops | Box Blog,The Importance of Code Reviews,Don't document your code. Code your documentation.,What to look for in a code review ,Leveling Up Your JavaScript -
4117174730087083056,Revolutionize business communication with Kast,[Coursera] Introduction to Communication Science - University of Amsterdam | Coursera,12 Agile principles,How to Create a Unified Culture in a Company With Multiple Offices,The new paradigm for human-bot communication,Changing change management
5308984234271987921,8 Unexpected Signs You're Smarter Than Average,Big data's 'streetlight effect': where and how we look affects what we see,"Little girls doubt that women can be brilliant, study shows",Most People Say They Could Get Rid of Tons of Stuff and Still Be Happy,The Three Language Acquisition Stages,The next AI is no AI
-324861070284719256,12 Best Slack Communities for Every Professional,How people using Slack to organise their grocery lists is helping it grow,Slack and Google announce partnership focused on better integrating their services,Building on Slack Saved Our Startup,So long MVP. Hello Minimum Loveable Product.,Introducing Sign in with Slack - Slack Platform Blog
-5204755921272353160,The Progress of Web Apps - On the Edge,The Business Case for Progressive Web Apps,Windows 10 Anniversary SDK is bringing exciting opportunities to developers,Creating Universal Windows Apps with React Native,Introducing Docker for Windows Server 2016 - Docker Blog,Microsoft's mobile problem may not be a problem at all
5302085907556673015,Google employees are adding 'Lady' to their job titles to fight sexism,Google's Cloud Investments are Finally Starting to Pay Off,How the queen of Silicon Valley is helping Google go after Amazon's most profitable business,Google I/O 2016 Preview: A Chrome/Android merger? Project Tango? VR?,Google Cloud Platform: The smart person's guide - TechRepublic,Google connects BigQuery to Google Drive and Sheets
-377975173223377441,"DARPA Goes ""Meta"" with Machine Learning for Machine Learning",Doing Data Science Right - Your Most Common Questions Answered,Building a high-throughput data science machine,"The ""Joel Test"" for Data Science",Engineers Shouldn't Write ETL: A Guide to Building a High Functioning Data Science Department,Opening Up Data Science with data.world - Jono Bacon
-5179565226573622983,App distribution for Linux just got way better,The Best Linux Distros of 2016,​Microsoft and Canonical partner to bring Ubuntu to Windows 10 | ZDNet,Developers can run Bash Shell and user-mode Ubuntu Linux binaries on Windows 10,How to Install and Use the Linux Bash Shell on Windows 10,Visual C++ for Linux Development
-1687864471892802710,[Videos] Bill Gross: The single biggest reason why startups succeed,Blaise Agüera y Arcas: How computers are learning to be creative,Julia Galef: Why you think you're right -- even if you're wrong,[Videos] This fake TED Talk about nothing might be the best you've ever seen,BIG BRAND REDEMPTION | New free Trend Briefing from TrendWatching,Coca-Cola reportedly closes Founders startup incubator
1433393829724383645,Why 2016 is shaping up to be the Year of the Bot,To bot or not to bot,Introduction To Chatbots,Facebook Messenger bots are here and they want to kill apps,2016 will be the year of conversational commerce - Chris Messina,How will bots make money? Here are 7 business models
-3590865837401183812,Flipping the office telepresence model,How Robots Can Acquire New Skills from Their Shared Experience,"How to build a robot that ""sees"" with $100 and TensorFlow","How to build a robot that ""sees"" with $100 and TensorFlow","Cozmo Is the Smartest, Cutest AI-Powered Robot You've Ever Seen","Meet Articoolo, the robot writer with content for brains"
-5060993828460133882,Globant Recognized as a Worldwide Leader of Digital Strategy Consulting Services by IDC MarketScape report,Globant acquires WAE to continue advancing in the creation of digital journeys,Globant Acquires L4 to Strengthen its Lead Position in the Digital Services Space,Cognizant Named a Digital Transformation Leader in the Life Science Industry,Future Of Consulting: Consultancies Adapt To Digital Change,Where is the bank's digital vision? - Chris Skinner's blog
4300652811307550975,StrictMode for Runtime Analysis on Android - Google Developers,What 2 Years of Android Development Have Taught Me the Hard Way - Thought's by Aritra Roy,"What's new in Android: the N-Release, Virtual Reality, Android Studio 2.2 and more | Android Developers Blog",Why porting an iOS design to Android will not work,Android Studio 2.0 | Android Developers Blog,Android Studio 2.2
-3870015206307768313,PCI Compliance & Drupal Commerce: Which Payment Gateway Should I Choose?,A simple approach to PCI DSS compliance for Google Cloud Platform,Bringing easy and fast checkout with Payment Request API | Web Updates - Google Developers,Evaluating the security of Drupal contrib modules,"PayPal's Braintree Auth launches to bring its payments platform to more merchants, service providers",14 Cool Drupal 8 modules for site builders | August 2016
-6999287066519531005,Lightning Distribution for Drupal: Build Advanced Authoring Experiences in Drupal 8,"Acquia Releases Lightning for Drupal 8, Enabling Fast Starts for Digital Experience Deployments [July 19, 2016]",Dries Distributions remain a growing opportunity for Drupal - Buytaert,Dries Buytaert,Drupal and ambitious digital experiences,Drupal 8 is 1 Year Old (AND YOU GET A PRIZE!)
-4338308747999225618,How the queen of Silicon Valley is helping Google go after Amazon's most profitable business,Diane Greene wants to put the enterprise front and center of Google Cloud strategy,"Google Showcases Its Cloud Efforts, Determined to Catch Up to Rivals","Google admits original enterprise cloud strategy was wrong, why it's gone in a different direction - TechRepublic",Google cloud boss Diane Greene: We're winning against AWS and Microsoft,Google Cloud Platform: The smart person's guide - TechRepublic
5239464617027010625,The Biggest list of 35 FREE UX Books,How Mature is Your Organization when it Comes to UX?,Google Play Books Now Analyzes Your Reading Habits and Recommends New Books,Engineering Digital Banking Solutions Using UX Methodology,How to overcome UX challenges with product design sprints,Why 5 is the magic number for UX usability testing
-945863510619496974,HHVM vs PHP 7 - The Competition Gets Closer - Kinsta,Learn About the PHP Trends and Predictions for 2017,20 Awesome PHP Libraries For Summer 2016,PHP 7 Support in PhpStorm 2016.2,Debugging WordPress: 11 Powerful Tips and Techniques,20 Awesome PHP Libraries For Early 2017
-4320251915347436672,Trooly is using machine learning to judge trustworthiness from digital footprints,Machine Learning for Designers,Building a digital-banking business,Machine Learning as a Service: How Data Science Is Hitting the Masses,"Practical advice for analysis of large, complex data sets",5 Skills You Need to Become a Machine Learning Engineer | Udacity
-5253644367331262405,"Hello, TensorFlow!",Celebrating TensorFlow's First Year,Announcing TensorFlow 0.8 - now with distributed computing support!,Google launches distributed version of its TensorFlow machine learning system,TensorFlow v0.9 now available with improved mobile support,TensorFlow Tutorial- Part 1
2405689222645002684,Thorium,The Famous Photo of Chernobyl's Most Dangerous Radioactive Material Was a Selfie,Portugal runs for four days straight on renewable energy alone,Bot Design Patterns,Google shares data center security and design best practices,Microsoft's Digital Post-It Is Powered By Your Office's Horrible Lighting
4788854083489560153,Node.js Examples - How Enterprises use Node in 2016 | @RisingStack,Welcome Google Cloud Platform!,Four Node.js Gotchas that Operations Teams Should Know about - The New Stack,World's Fastest Growing Open Source Platform Pushes Out New Release,Node.js Best Practices - How to Become a Better Developer in 2017 | @RisingStack,The Top 10 Most Common Mistakes That Node.js Developers Make
3075810310719170278,Machine Learning is Fun!,5 Skills You Need to Become a Machine Learning Engineer | Udacity,Machine Learning for Designers,How to choose algorithms for Microsoft Azure Machine Learning,Stop Coding Machine Learning Algorithms From Scratch - Machine Learning Mastery,How real businesses are using machine learning
3180608611815082945,Machine Learning is Fun! Part 2,Machine Learning is Fun!,Machine Learning is Fun! Part 3: Deep Learning and Convolutional Neural Networks,ŷhat | Classifying handwritten digits using TensorFlow,Nintendo to Release Mini NES with 30 Pre-Loaded Games in November!,"Deep Learning for Chatbots, Part 2 - Implementing a Retrieval-Based Model in Tensorflow"
216869981229779312,Machine Learning is Fun! Part 3: Deep Learning and Convolutional Neural Networks,rasbt/python-machine-learning-book,A Beginner's Guide To Understanding Convolutional Neural Networks,Why Deep Learning Is Suddenly Changing Your Life,Number plate recognition with Tensorflow,Generative Models
1021466437456217445,Lists are the new search,How to Improve 8 Major Problem Areas for Japanese Learners of All Levels,"5 awesome Google Keep features you aren't using, but should be",This year's Founders' Letter,This 8-Page Website Generated Six-Figures in its First 8 Months - gaps,Google I/O 2016: Android's failure to innovate hands a Apple free run at WWDC
2809702925357288303,"Build your own scalable, location analysis platform with Google Cloud Platform and Maps APIs",Google connects BigQuery to Google Drive and Sheets,Google Cloud Platform: The smart person's guide - TechRepublic,"BigQuery 1.11, now with Standard SQL, IAM, and partitioned tables! | Google Cloud Big Data and Machine Learning Blog",BigQuery goes wide: this week on Google Cloud Platform,GitHub on BigQuery: Analyze all the open source code
6737022915341644067,You can now use MyCokeRewards with Apple Pay (and score a free Coke),"Walgreens now lets you digitally clip coupons from its iOS app, redeem in-store through Apple Pay with loyalty card",Don't take my money: Why mobile payments haven't taken off - yet,What to Expect at WWDC 2016,"Apple, Set to Move to Its Spaceship, Should Try More Moonshots",How Starbucks became so successful at coaxing consumers to pay with smartphones
-7342604649736473979,Docker 1.12: Now with Built-in Orchestration!,Docker Swarm,A Docker Fork: Talk of a Split Is Now on the Table - The New Stack,Your Docker Agenda for April,Docker Engine 1.11 with runC: Announcing the general availability of the industry's first OCI-compliant runtime,Why You Should Stop Installing Your WebDev Environment Locally - Smashing Magazine
-4336877432539963613,Comparing IoT Platforms: Compare 4 IoT platform for IoT projects,Intel's internal IoT platform for real-time enterprise analytics,Bring a dinosaur to life with Watson IoT Platform and Node-RED,Decentralizing IoT networks through blockchain,IoT Day: A timeline of how IoT is changing the world (infographic),Relating a Problem Definition to IoT Architecture | Intel® Software
-8863047175241170722,Big data's 'streetlight effect': where and how we look affects what we see,"Practical advice for analysis of large, complex data sets",Lessons from Becoming a Data-Driven Organization,Doing Data Science Right - Your Most Common Questions Answered,Opening Up Data Science with data.world - Jono Bacon,Stop Trying to Monetize Your Data - Built to Adapt
-2402157201203242566,Number26 raises another $40 million for its vision for the future of banking,Digital is all about the people - Chris Skinner's blog,The #digital upstarts offering app-only #banking for smartphone users #benchmark,Is FinTech Forcing Banking to a Tipping Point?,Building a digital-banking business,Mobile-Only Challenger Banks Are Shaping the Future of Financial Services Industry
-3351656282247453586,Microsoft expands its support for Docker containers,Windows Server 2016 will come with commercial support for Docker Engine,A Docker Fork: Talk of a Split Is Now on the Table - The New Stack,Your Docker Agenda for April,Introducing Docker for Windows Server 2016 - Docker Blog,Docker Engine 1.11 with runC: Announcing the general availability of the industry's first OCI-compliant runtime
-5395935973320542237,"Slack debuts message buttons: bots with Trello, Kayak and 10 more to perform tasks in its app",Slack and Google announce partnership focused on better integrating their services,Message buttons and the Slack API - Slack Platform Blog,Introducing Sign in with Slack - Slack Platform Blog,How people using Slack to organise their grocery lists is helping it grow,IBM Watson is about to make Slack's chat bot smarter
-3552937095886146934,The Netflix Tech Blog: Netflix Billing Migration to AWS,How We Migrated Data into Drupal from Four Different Sources Using the Migrate Module | Acquia,The five phases of migrating to Google Cloud Platform,Spark comparison: AWS vs. GCP,Lessons learned from a year of using live migration in production on Google Cloud,What's the Best Cloud? Probably GCP
-486686184692655504,New settings for 2-Step Verification,Dial in with ease using the latest Google Calendar app for Android,Add images to questions and answers in Google Forms,Introducing Casting into Hangouts,Stay focused with Google Calendar event notifications in your browser,Making email safer with new security warnings in Gmail
8920226233198909725,OpenAI technical goals,OpenAI,"Inside OpenAI, Elon Musk's Wild Plan to Set Artificial Intelligence Free",Stop Coding Machine Learning Algorithms From Scratch - Machine Learning Mastery,Here's how The White House wants the U.S. to approach AI R&D,Machine Learning for Designers
-5405021817466310759,Why 5 is the magic number for UX usability testing,7 Mistakes Most Beginners Make When A/B Testing,How Netflix does A/B testing - InVision Blog,Firebase Test Lab for Android,How Netflix does A/B Testing - uxdesign.cc - User Experience Design,How Netflix does A/B Testing - uxdesign.cc - User Experience Design
1339353160969606996,Enable secure mode on your web product | Intercom Docs,The moment when you realize every server in the world is vulnerable - Free Code Camp,How to write a Bloom filter in C++,Email Isn't The Thing You're Bad At,Customer Supplied Encryption Keys in Cloud Storage now in beta,What to look for in a code review 
3322348437880079228,Ultimate AI battle - Apple vs. Google,An Exclusive Look at How AI and Machine Learning Work at Apple - Backchannel,"Apple, Set to Move to Its Spaceship, Should Try More Moonshots",What to Expect at WWDC 2016,WWDC 2016 preview: How to watch &amp; what to expect at Apple's event on Monday,Today in Apple history: 'Here's to the crazy ones...' | Cult of Mac
4189221198175710203,How Wimbledon will use IBM's Watson to serve up data - BBC News,Sony Smart Tennis Sensor for Tennis Rackets,Digital transformation in the Premier League: Southampton FC's fan-first strategy,IBM makes a big shift into cognitive computing,IBM wants to bring machine learning to the mainframe,Lessons from Becoming a Data-Driven Organization
-8412113620940365599,The best-and worst-places to be a working woman,"If you think women in tech is just a pipeline problem, you haven't been paying attention - Tech Diversity Files",Equal Pay Day in the spotlight this year,Glamour Exclusive: President Obama On Feminism and The World He Wants to Leave His Daughters,Susan Wojcicki on the Effectiveness of Empowering Ads on YouTube,Susan Wojcicki on the Effectiveness of Empowering Ads on YouTube
6798386551136144335,Espressif Releases ESP8266-Killer!,Chip Pro sequel to crowdsourced $9 computer sets its sights on gadget makers,The Internet of Things is looking for its VisiCalc,This is the flying chainsaw drone you knew was coming,The Physical Web,Google moves to replace Flash with HTML5
-5839185923562195912,What's the Version of my Deployed Application? - DZone DevOps,Test and deploy to Google App Engine with the new Maven and Gradle plugins,Creating Code Coverage Reports for Unit and Integration Tests With the JaCoCo Maven Plugin,Introduction to Spring REST Docs | Baeldung,Spring Boot 1.4 released,Java Tools and Technologies Landscape Report 2016 | zeroturnaround.com
-820343972901090172,Stop saying learning to code is easy.,Learning How to Learn: The Most Important Developer Skill - Free Code Camp,What to look for in a code review ,Writing good code: how to reduce the cognitive load of your code,Leveling Up Your JavaScript -,Don't document your code. Code your documentation.
-7126520323752764957,"How Google is Remaking Itself as a ""Machine Learning First"" Company - Backchannel","How Google is Remaking Itself as a ""Machine Learning First"" Company - Backchannel",How real businesses are using machine learning,Google's Cloud Machine Learning service is now in public beta,Machine Learning Is No Longer Just for Experts,5 Skills You Need to Become a Machine Learning Engineer | Udacity
1177957942021788639,New Google Cloud Platform Education Grants offer free credits to students,Google Cloud Platform: The smart person's guide - TechRepublic,"Google admits original enterprise cloud strategy was wrong, why it's gone in a different direction - TechRepublic",Google Cloud Platform sets a course for new horizons,8 must-see sessions for application developers at Google Cloud Next '17,Google's Cloud Machine Learning service is now in public beta
1190376095547142533,"Advertiser that tracked >100 million phone users without consent pays $950,000",98 personal data points that Facebook uses to target ads to you,Google : End Of The Online Advertising Bubble,Breaking: Apple's Search Ads go LIVE!,"Telecoms open shop on Madison Avenue, but will brands buy?",Mobile UX Design: The Right Ways to Ask Users for Permissions - UX Planet
-398780385766545248,10 Stats About Artificial Intelligence That Will Blow You Away -- The Motley Fool,"Google, Amazon and the upcoming battle over AI Assistants",Top 10 Hot Artificial Intelligence (AI) Technologies,Andrew Ng: What AI Can and Can't Do,Here's how The White House wants the U.S. to approach AI R&D,The return of the machinery question
-2318171567839609160,Google Fiber agrees to acquire Webpass,Google's Cloud Investments are Finally Starting to Pay Off,Google cloud boss Diane Greene: We're winning against AWS and Microsoft,Google I/O 2016 Preview: A Chrome/Android merger? Project Tango? VR?,Google connects BigQuery to Google Drive and Sheets,Google Cloud Platform: The smart person's guide - TechRepublic
-92787874211637246,Analyst: Google's cloud business could cause the stock to soar to over $900,How the queen of Silicon Valley is helping Google go after Amazon's most profitable business,Diane Greene wants to put the enterprise front and center of Google Cloud strategy,Google Cloud Platform: The smart person's guide - TechRepublic,"Google admits original enterprise cloud strategy was wrong, why it's gone in a different direction - TechRepublic",Google cloud boss Diane Greene: We're winning against AWS and Microsoft
491373795166252904,Teaching machines to predict the future,An MIT Algorithm Predicts the Future by Watching TV,Artificial intelligence produces realistic sounds that fool humans,"Deep-learning algorithm predicts photos' memorability at ""near-human"" levels",Google DeepMind researchers built a deep-learning system capable of learning from very little data.,Google researchers teach AIs to see the important parts of images - and tell you about them
1058405970043104639,​Google digs deeper on machine learning with new European research lab,Google creates new European research group to focus on machine learning,"How Google is Remaking Itself as a ""Machine Learning First"" Company - Backchannel","How Google is Remaking Itself as a ""Machine Learning First"" Company - Backchannel",Machine Intelligence - Research at Google,Google's Cloud Machine Learning service is now in public beta
-2774293088092853604,Message buttons and the Slack API - Slack Platform Blog,"Slack debuts message buttons: bots with Trello, Kayak and 10 more to perform tasks in its app",Introducing Sign in with Slack - Slack Platform Blog,Slack and Google announce partnership focused on better integrating their services,How people using Slack to organise their grocery lists is helping it grow,IBM Watson is about to make Slack's chat bot smarter
4751741894255718069,What do Design Thinking and Marketing have in common?,Time to Re-Think Design Thinking,The Future of Business is Design,[E-learning] Design Thinking for Innovation - University of Virginia | Coursera,What exactly is a design culture? ,Three Lessons for Design-Driven Success
-4503975842879662368,Google Ranking Factors: The Complete List,7 Vital SEO Trends for Google Rankings in 2017 | Digital Current,8 Old School SEO Practices That Are No Longer Effective - Whiteboard Friday,The Ultimate Guide to SEO Reporting: Starting with the Basics,13 Killer SEO Copywriting Tips (With Examples and A/B Tests),This 8-Page Website Generated Six-Figures in its First 8 Months - gaps
1379546145237381445,Eclipse Foundation Releases Neon,Expanding our IDE support with a new Eclipse plugin for App Engine,Support Ended for Eclipse Android Developer Tools,Java 8 Streams - A Deeper Approach About Performance Improvement,Java Tools and Technologies Landscape Report 2016 | zeroturnaround.com,New free Trend Briefing from TrendWatching | INNOVATION CELEBRATION 2016
-7568926158048616650,Adobe CQ/Adobe AEM,Adobe CQ/Adobe AEM,Adobe CQ/Adobe AEM,AEM 6.1 Package Manager Metadata Files,AEM 6.1 Packages and Bundles - Installing and Uninstalling Behavior,What's the Version of my Deployed Application? - DZone DevOps
-8632408281960398473,Adobe CQ/Adobe AEM,Adobe CQ/Adobe AEM,Adobe CQ/Adobe AEM,AEM 6.1 Package Manager Metadata Files,AEM 6.1 Packages and Bundles - Installing and Uninstalling Behavior,What's the Version of my Deployed Application? - DZone DevOps
984451487666392184,Caching best practices & max-age gotchas,Progressive Web App - first introduced on Google I/O | airberlin,Community,"Front-End Performance Checklist 2017 (PDF, Apple Pages) - Smashing Magazine",Building for HTTP/2,Speed Up a WordPress Website in 8 Steps
-1055630159212837930,Facial recognition systems stumble when confronted with million-face database,Why image recognition is about to transform business,"Machine Learning Can Identify Pixelated Faces, Researchers Show",Power to the People: How One Unknown Group of Researchers Holds the Key to Using AI to Solve Real...,Power to the People: How One Unknown Group of Researchers Holds the Key to Using AI to Solve Real...,Vision API - Image Content Analysis
-742603651309629354,JetBrains DataGrip: Your Swiss Army Knife for Databases and SQL,Advancing enterprise database workloads on Google Cloud Platform,The Importance of Code Reviews,The Definitive Guide to Database Version Control,Effective learning through code workshops | Box Blog,Writing good code: how to reduce the cognitive load of your code
5816734694927565572,Bot Design Patterns,Develop your first Facebook messenger bot in PHP,To bot or not to bot,How to Start a Telegram Bot With PHP,Usability Heuristics for Bots - Chatbots Magazine,How will bots make money? Here are 7 business models
-659411840002799494,Bill Gates Recommends These 9 Books to Make You a Better Entrepreneur and a Better Person,Good to Great,Behind the Scam: What Does It Take to Be a 'Best-Selling Author'? $3 and 5 Minutes. - The Mission,So long MVP. Hello Minimum Loveable Product.,2016's Best Books for Entrepreneurs (So Far),"Brian Kernighan on the typesetting of ""The Go Programming Language"" book"
